smartctl 7.3 2022-02-28 r5338 [x86_64-linux-6.2.16-12-pve] (local build)
Copyright (C) 2002-22, Bruce Allen, Christian Franke, www.smartmontools.org

CHECK POWER MODE not implemented, ignoring -n option
=== START OF INFORMATION SECTION ===
Model Family: Marvell based SanDisk SSDs
Device Model: SanDisk SSD PLUS 480GB
Serial Number: 123AF4567890
LU WWN Device Id: 5 001b44 54e51cae0
Firmware Version: UG2204RL
User Capacity: 480,103,981,056 bytes [480 GB]
Sector Size: 512 bytes logical/physical
Rotation Rate: Solid State Device
Form Factor: 2.5 inches
TRIM Command: Available, deterministic
Device is: In smartctl database 7.3/5319
ATA Version is: ACS-3, ACS-2 T13/2015-D revision 3
SATA Version is: SATA 3.2, 6.0 Gb/s (current: 6.0 Gb/s)
Local Time is: Wed Jan 24 17:19:57 2024 CET
SMART support is: Available - device has SMART capability.
SMART support is: Enabled

=== START OF READ SMART DATA SECTION ===
SMART Status not supported: ATA return descriptor not supported by controller firmware
SMART overall-health self-assessment test result: PASSED
Warning: This result is based on an Attribute check.

SMART Attributes Data Structure revision number: 1
Vendor Specific SMART Attributes with Thresholds:
ID# ATTRIBUTE_NAME          FLAGS    VALUE WORST THRESH FAIL RAW_VALUE
  5 Reallocated_Sector_Ct   -O--CK   100   100   000    -    0
  9 Power_On_Hours          -O--CK   100   100   000    -    10150
 12 Power_Cycle_Count       -O--CK   100   100   000    -    13
165 Total_Write/Erase_Count -O--CK   100   100   000    -    988
166 Min_W/E_Cycle           -O--CK   100   100   ---    -    4
167 Min_Bad_Block/Die       -O--CK   100   100   ---    -    25
168 Maximum_Erase_Cycle     -O--CK   100   100   ---    -    22
169 Total_Bad_Block         -O--CK   100   100   ---    -    264
170 Unknown_Marvell_Attr    -O--CK   100   100   ---    -    0
171 Program_Fail_Count      -O--CK   100   100   000    -    0
172 Erase_Fail_Count        -O--CK   100   100   000    -    0
173 Avg_Write/Erase_Count   -O--CK   100   100   000    -    4
174 Unexpect_Power_Loss_Ct  -O--CK   100   100   000    -    4
184 End-to-End_Error        -O--CK   100   100   ---    -    0
187 Reported_Uncorrect      -O--CK   100   100   000    -    0
188 Command_Timeout         -O--CK   100   100   ---    -    0
194 Temperature_Celsius     -O---K   065   068   000    -    35 (Min/Max 15/68)
199 SATA_CRC_Error          -O--CK   100   100   ---    -    0
230 Perc_Write/Erase_Count  -O--CK   100   100   000    -    594 80 594
232 Perc_Avail_Resrvd_Space PO--CK   100   100   005    -    100
233 Total_NAND_Writes_GiB   -O--CK   100   100   ---    -    1929
234 Perc_Write/Erase_Ct_BC  -O--CK   100   100   000    -    12242
241 Total_Writes_GiB        ----CK   100   100   000    -    4708
242 Total_Reads_GiB         ----CK   100   100   000    -    478
244 Thermal_Throttle        -O--CK   000   100   ---    -    0
                            ||||||_ K auto-keep
                            |||||__ C event count
                            ||||___ R error rate
                            |||____ S speed/performance
                            ||_____ O updated online
                            |______ P prefailure warning

