smartctl 7.4 2023-08-01 r5530 [x86_64-linux-6.7.0-arch3-1] (local build)
Copyright (C) 2002-23, Bruce Allen, Christian Franke, www.smartmontools.org

=== START OF INFORMATION SECTION ===
Model Family:     Hitachi Deskstar P7K500
Device Model:     Hitachi HDP725050GLA360
Serial Number:    GE123456789123
LU WWN Device Id: 5 000cca 123456789
Firmware Version: GM4OA5CA
User Capacity:    500 107 862 016 bytes [500 GB]
Sector Size:      512 bytes logical/physical
Rotation Rate:    7200 rpm
Device is:        In smartctl database 7.3/5528
ATA Version is:   ATA8-ACS T13/1699-D revision 4
SATA Version is:  SATA 2.6, 3.0 Gb/s
Local Time is:    Tue Jan 23 15:16:17 2024 CET
SMART support is: Available - device has SMART capability.
SMART support is: Enabled
Power mode is:    ACTIVE or IDLE

=== START OF READ SMART DATA SECTION ===
SMART overall-health self-assessment test result: PASSED

SMART Attributes Data Structure revision number: 16
Vendor Specific SMART Attributes with Thresholds:
ID# ATTRIBUTE_NAME          FLAGS    VALUE WORST THRESH FAIL RAW_VALUE
  1 Raw_Read_Error_Rate     PO-R--   100   100   016    -    0
  2 Throughput_Performance  P-S---   132   132   054    -    140
  3 Spin_Up_Time            POS---   120   120   024    -    307 (Average 333)
  4 Start_Stop_Count        -O--C-   100   100   000    -    865
  5 Reallocated_Sector_Ct   PO--CK   100   100   005    -    0
  7 Seek_Error_Rate         PO-R--   100   100   067    -    0
  8 Seek_Time_Performance   P-S---   129   129   020    -    30
  9 Power_On_Hours          -O--C-   092   092   000    -    57390
 10 Spin_Retry_Count        PO--C-   100   100   060    -    0
 12 Power_Cycle_Count       -O--CK   100   100   000    -    698
192 Power-Off_Retract_Count -O--CK   098   098   000    -    2419
193 Load_Cycle_Count        -O--C-   098   098   000    -    2419
194 Temperature_Celsius     -O----   187   187   000    -    32 (Min/Max 14/58)
196 Reallocated_Event_Count -O--CK   100   100   000    -    0
197 Current_Pending_Sector  -O---K   100   100   000    -    0
198 Offline_Uncorrectable   ---R--   100   100   000    -    0
199 UDMA_CRC_Error_Count    -O-R--   200   200   000    -    3044
                            ||||||_ K auto-keep
                            |||||__ C event count
                            ||||___ R error rate
                            |||____ S speed/performance
                            ||_____ O updated online
                            |______ P prefailure warning

