smartctl 7.2 2020-12-30 r5155 [x86_64-linux-5.15.0-91-generic] (local build)
Copyright (C) 2002-20, Bruce Allen, Christian Franke, www.smartmontools.org

=== START OF INFORMATION SECTION ===
Model Number:                       KXG50ZNV512G NVMe TOSHIBA 512GB
Serial Number:                      18DS11V9TY8T
Firmware Version:                   AADA4102
PCI Vendor/Subsystem ID:            0x1179
IEEE OUI Identifier:                0x00080d
Total NVM Capacity:                 512,110,190,592 [512 GB]
Unallocated NVM Capacity:           0
Controller ID:                      0
NVMe Version:                       1.2.1
Number of Namespaces:               1
Namespace 1 Size/Capacity:          512,110,190,592 [512 GB]
Namespace 1 Formatted LBA Size:     512
Namespace 1 IEEE EUI-64:            00080d 02003b88f8
Local Time is:                      Wed Jan 24 16:55:55 2024 CET
  
=== START OF SMART DATA SECTION ===
SMART overall-health self-assessment test result: PASSED
  
SMART/Health Information (NVMe Log 0x02)
Critical Warning:                   0x00
Temperature:                        55 Celsius
Available Spare:                    100%
Available Spare Threshold:          10%
Percentage Used:                    11%
Data Units Read:                    29,311,385 [15.0 TB]
Data Units Written:                 36,737,279 [18.8 TB]
Host Read Commands:                 665,831,489
Host Write Commands:                998,863,020
Controller Busy Time:               2,510
Power Cycles:                       539
Power On Hours:                     14,202
Unsafe Shutdowns:                   126
Media and Data Integrity Errors:    0
Error Information Log Entries:      0
Warning  Comp. Temperature Time:    0
Critical Comp. Temperature Time:    0
Temperature Sensor 1:               55 Celsius

